{
  "schemaVersion": "abrxos.content-project.r6",
  "projectId": "JOC55_AMANDA",
  "title": "JOC55 Amanda · Intro R6.1 Prebuild",
  "pieces": [
    {
      "id": "intro_amanda_new_01",
      "canonicalId": "INTRO_AMANDA_NEW_01",
      "projectId": "JOC55_AMANDA",
      "type": "intro",
      "title": "Amanda · Información, pérdida, oportunidad y propósito",
      "thesis": "La dificultad de encontrar una ruta y la decisión de compartir información se convierten en una oportunidad construida con propósito.",
      "objective": "Construir un trailer narrativo de contraste, pérdida, agencia, oportunidad y open loops de negocio sin revelar el payoff del modelo.",
      "source": "DEFAULT",
      "stage": "ALFA",
      "workflowStatus": "PENDIENTE",
      "included": true,
      "schedule": {
        "date": "",
        "time": "",
        "platforms": [],
        "publishedAt": null
      },
      "editProfile": {
        "code": "XR_FULL",
        "commercialName": "Cinematic Edit"
      },
      "sourceAlignment": [
        {
          "id": "P01_SHARE_INFO",
          "speaker": "AMANDA",
          "desiredText": "Las personas piensan que por compartir la información estás dando la información gratuita y la persona ya no va a necesitar de tu ayuda…",
          "cueIds": [
            739,
            740
          ],
          "status": "cue_based",
          "microtrim": true,
          "startAnchor": "a veces las personas piensan que por compartir la información",
          "endAnchor": "ayuda",
          "note": "La frase empieza dentro del cue 739 y debe terminar antes de «pero es todo lo contrario» dentro del cue 740.",
          "parentStartTc": "01:10:20.687",
          "parentEndTc": "01:10:36.731",
          "parentStart": 4220.687,
          "parentEnd": 4236.731,
          "parentCueText": "que si tú, por ejemplo, vendes un servicio o así sea algo educacional o consultoría o lo que sea, a veces las personas piensan que por compartir la información estás dando la información gratuita y la persona ya no va a necesitar de tu ayuda, pero es todo lo contrario."
        },
        {
          "id": "P02_CONTRARY",
          "speaker": "AMANDA",
          "desiredText": "Pero es todo lo contrario.",
          "cueIds": [
            740
          ],
          "status": "cue_based",
          "microtrim": true,
          "startAnchor": "pero es todo lo contrario",
          "endAnchor": "contrario",
          "note": "Está al final del cue 740; requiere microtrim de inicio.",
          "parentStartTc": "01:10:31.780",
          "parentEndTc": "01:10:36.731",
          "parentStart": 4231.78,
          "parentEnd": 4236.731,
          "parentCueText": "información gratuita y la persona ya no va a necesitar de tu ayuda, pero es todo lo contrario."
        },
        {
          "id": "P03_MAJORITY_FREE",
          "speaker": "AMANDA",
          "desiredText": "La mayoría de la información que nosotros damos es completamente gratuita.",
          "cueIds": [
            506
          ],
          "status": "cue_based",
          "microtrim": true,
          "startAnchor": "la mayoría de la información que nosotros damos",
          "endAnchor": "gratuita",
          "note": "Está dentro del cue 506 después de «más bien».",
          "parentStartTc": "00:47:07.405",
          "parentEndTc": "00:47:14.098",
          "parentStart": 2827.405,
          "parentEnd": 2834.098,
          "parentCueText": "sea, nosotros no somos para nada de guardar la información, más bien la mayoría de la información que nosotros damos es completamente gratuita."
        },
        {
          "id": "P04_FATHER_IDOL",
          "speaker": "AMANDA",
          "desiredText": "Mi papá para mí era mi ídolo profesional.",
          "cueIds": [
            180
          ],
          "status": "cue_based",
          "microtrim": true,
          "startAnchor": "Mi papá para mí era mi ídolo profesional",
          "endAnchor": "profesional",
          "note": "Cue 180 continúa con «ejemplo de liderazgo…»; cortar después de «profesional».",
          "parentStartTc": "00:15:58.835",
          "parentEndTc": "00:16:07.122",
          "parentStart": 958.835,
          "parentEnd": 967.122,
          "parentCueText": "Mi papá para mí era mi ídolo profesional, ejemplo de liderazgo, ejemplo de todo, de cómo tratar a los demás, como..."
        },
        {
          "id": "P05_FATHER_DIES",
          "speaker": "AMANDA",
          "desiredText": "Y justamente un mes antes de yo graduarme de la universidad, mi papá fallece.",
          "cueIds": [
            413
          ],
          "status": "cue_verified",
          "microtrim": false,
          "note": "El cue coincide con la frase solicitada.",
          "parentStartTc": "00:37:13.918",
          "parentEndTc": "00:37:18.900",
          "parentStart": 2233.918,
          "parentEnd": 2238.9,
          "parentCueText": "Y justamente un mes antes de yo graduarme de la universidad, mi papá fallece."
        },
        {
          "id": "P06_HOLE",
          "speaker": "AMANDA",
          "desiredText": "Y eso me hizo entrar como en un hueco que yo decía ahora yo no sé qué hacer.",
          "cueIds": [
            415
          ],
          "status": "cue_based",
          "microtrim": true,
          "startAnchor": "y eso me hizo entrar",
          "endAnchor": "qué hacer",
          "note": "El cue empieza con «Él falleció por cáncer»; el plan omite ese prefijo.",
          "parentStartTc": "00:37:21.691",
          "parentEndTc": "00:37:29.384",
          "parentStart": 2241.691,
          "parentEnd": 2249.384,
          "parentCueText": "Él falleció por cáncer y eso me hizo entrar como en un hueco que yo decía ahora yo no sé qué hacer."
        },
        {
          "id": "P07_USA",
          "speaker": "AMANDA",
          "desiredText": "Y decidí básicamente irme a Estados Unidos.",
          "cueIds": [
            421
          ],
          "status": "cue_verified",
          "microtrim": false,
          "note": "Cue completo.",
          "parentStartTc": "00:37:54.289",
          "parentEndTc": "00:37:56.629",
          "parentStart": 2274.289,
          "parentEnd": 2276.629,
          "parentCueText": "Y decidí básicamente irme a Estados Unidos."
        },
        {
          "id": "P08_REVALIDA",
          "speaker": "AMANDA",
          "desiredText": "Pero cuando empiezo a averiguar toda la información del tema de la reválida…",
          "cueIds": [
            422
          ],
          "status": "cue_based",
          "microtrim": true,
          "startAnchor": "Pero cuando empiezo a averiguar",
          "endAnchor": "revalida",
          "note": "El cue continúa con «era tanta información…»; el plan corta antes.",
          "parentStartTc": "00:37:56.629",
          "parentEndTc": "00:38:04.889",
          "parentStart": 2276.629,
          "parentEnd": 2284.889,
          "parentCueText": "Pero cuando empiezo a averiguar toda la información del tema de la revalida, era tanta información en Internet y la gente te decía una cosa y otras personas te decían otras."
        },
        {
          "id": "P09_NO_SHARE",
          "speaker": "AMANDA",
          "desiredText": "Había gente que no te quería compartir información",
          "cueIds": [
            423
          ],
          "status": "cue_based",
          "microtrim": true,
          "startAnchor": "Había gente que no te quería compartir información",
          "endAnchor": "información",
          "note": "El cue continúa «que ya lo había logrado».",
          "parentStartTc": "00:38:04.889",
          "parentEndTc": "00:38:08.634",
          "parentStart": 2284.889,
          "parentEnd": 2288.634,
          "parentCueText": "Había gente que no te quería compartir información, que ya lo había logrado."
        },
        {
          "id": "P10_FEAR_IMPOSSIBLE",
          "speaker": "AMANDA",
          "desiredText": "querían infundir miedo, decir es súper difícil, es imposible, no lo vas a poder hacer",
          "cueIds": [
            424
          ],
          "status": "cue_based",
          "microtrim": true,
          "startAnchor": "querían infundir miedo",
          "endAnchor": "no lo vas a poder hacer",
          "note": "El cue comienza con «otras personas que sencillamente» y continúa hasta «me sobresaturé completamente».",
          "parentStartTc": "00:38:08.634",
          "parentEndTc": "00:38:18.030",
          "parentStart": 2288.634,
          "parentEnd": 2298.03,
          "parentCueText": "otras personas que sencillamente querían infundir miedo, decir es súper difícil, es imposible, no lo vas a poder hacer, que me sobresaturé completamente."
        },
        {
          "id": "P11_OVERSATURATED",
          "speaker": "AMANDA",
          "desiredText": "me sobresaturé completamente.",
          "correctedText": "me sobresaturé completamente.",
          "originalPlanText": "me sobresaltaré completamente.",
          "cueIds": [
            424
          ],
          "status": "cue_based",
          "microtrim": true,
          "startAnchor": "me sobresaturé completamente",
          "endAnchor": "completamente",
          "note": "Corrección de source truth: la transcripción dice «me sobresaturé», no «me sobresaltaré».",
          "parentStartTc": "00:38:08.634",
          "parentEndTc": "00:38:18.030",
          "parentStart": 2288.634,
          "parentEnd": 2298.03,
          "parentCueText": "otras personas que sencillamente querían infundir miedo, decir es súper difícil, es imposible, no lo vas a poder hacer, que me sobresaturé completamente."
        },
        {
          "id": "P12_DIFFICULTIES",
          "speaker": "AMANDA",
          "desiredText": "Las dificultades por las que pasas en la vida tienes dos opciones como todo.",
          "cueIds": [
            890,
            891
          ],
          "status": "cue_based",
          "microtrim": true,